{
  "imageId": "cuaderno-tanchy-3",
  "imageFile": "Cuaderno Tanchy_3.jpg",
  "sourceDataset": "data-avileo/JUAVIK",
  "pass": "pass-2",
  "extractedAt": "2026-03-28T00:00:00.000Z",
  "schemaVersion": "1.0.0",
  "imageLevelNotes": [
    "Second reading also detects an upper inherited block and a dated block starting mid-page."
  ],
  "ignoredDetachedText": [],
  "detectedDates": [
    {
      "rawText": "Lunes 9-2-26",
      "normalizedDate": "2026-02-09",
      "confidence": 0.96
    }
  ],
  "blocks": [
    {
      "blockIndex": 0,
      "date": {
        "rawText": null,
        "normalizedDate": null,
        "inheritedFromPreviousBlock": true,
        "confidence": 0.22
      },
      "blockNotes": [
        "Upper carry-over block."
      ],
      "lines": [
        {
          "lineIndex": 0,
          "rawLineText": "Floe = ... > 203P",
          "lineType": "carry_over_line",
          "customer": {
            "rawName": "Floe",
            "normalizedCandidate": "Floe",
            "similarTo": [],
            "confidence": 0.57
          },
          "entries": [
            {
              "entryIndex": 0,
              "entryType": "balance_reference",
              "description": "carry-over total",
              "customerRef": "Floe",
              "amount": 203.0,
              "paymentMethod": null,
              "paymentStatus": "unknown",
              "confidence": 0.76
            }
          ],
          "items": [],
          "operations": [],
          "amounts": {
            "subtotal": null,
            "total": 203.0,
            "amountPaid": null,
            "balanceDue": 203.0,
            "highlightedAmount": null
          },
          "payment": {
            "paymentMethod": null,
            "paymentStatus": "unknown",
            "yapeoConfirmed": false,
            "pendingYape": false,
            "noPago": false,
            "referencesPreviousPayment": false,
            "carryOverFromPrevious": true
          },
          "markers": {
            "hasCircledAmount": false,
            "hasArrow": true,
            "hasP": true,
            "hasNP": false,
            "hasYapeo": false,
            "hasXYapear": false
          },
          "reviewFlags": [
            "block_date_inherited",
            "marker_P_unclear"
          ],
          "notes": [],
          "confidence": 0.71
        }
      ]
    },
    {
      "blockIndex": 1,
      "date": {
        "rawText": "Lunes 9-2-26",
        "normalizedDate": "2026-02-09",
        "inheritedFromPreviousBlock": false,
        "confidence": 0.96
      },
      "blockNotes": [],
      "lines": [
        {
          "lineIndex": 0,
          "rawLineText": "Pancho x10.5 = 65.8",
          "lineType": "single_entry_line",
          "customer": {
            "rawName": "Pancho",
            "normalizedCandidate": "Pancho",
            "similarTo": [],
            "confidence": 0.94
          },
          "entries": [
            {
              "entryIndex": 0,
              "entryType": "sale",
              "description": "sale amount",
              "customerRef": "Pancho",
              "amount": 65.8,
              "paymentMethod": null,
              "paymentStatus": "unknown",
              "confidence": 0.89
            }
          ],
          "items": [
            {
              "rawText": "x10.5",
              "normalizedProductCandidate": null,
              "similarTo": [],
              "quantityText": null,
              "unitPrice": 10.5,
              "lineAmount": 65.8,
              "confidence": 0.84
            }
          ],
          "operations": [],
          "amounts": {
            "subtotal": 65.8,
            "total": 65.8,
            "amountPaid": null,
            "balanceDue": null,
            "highlightedAmount": null
          },
          "payment": {
            "paymentMethod": null,
            "paymentStatus": "unknown",
            "yapeoConfirmed": false,
            "pendingYape": false,
            "noPago": false,
            "referencesPreviousPayment": false,
            "carryOverFromPrevious": false
          },
          "markers": {
            "hasCircledAmount": false,
            "hasArrow": false,
            "hasP": false,
            "hasNP": false,
            "hasYapeo": false,
            "hasXYapear": false
          },
          "reviewFlags": [],
          "notes": [],
          "confidence": 0.89
        },
        {
          "lineIndex": 1,
          "rawLineText": "Nelda x10.7 = 68.3P",
          "lineType": "single_entry_line",
          "customer": {
            "rawName": "Nelda",
            "normalizedCandidate": "Nelda",
            "similarTo": [],
            "confidence": 0.89
          },
          "entries": [
            {
              "entryIndex": 0,
              "entryType": "sale",
              "description": "sale amount",
              "customerRef": "Nelda",
              "amount": 68.3,
              "paymentMethod": null,
              "paymentStatus": "unknown",
              "confidence": 0.82
            }
          ],
          "items": [
            {
              "rawText": "x10.7",
              "normalizedProductCandidate": null,
              "similarTo": [],
              "quantityText": null,
              "unitPrice": 10.7,
              "lineAmount": 68.3,
              "confidence": 0.78
            }
          ],
          "operations": [],
          "amounts": {
            "subtotal": 68.3,
            "total": 68.3,
            "amountPaid": null,
            "balanceDue": null,
            "highlightedAmount": null
          },
          "payment": {
            "paymentMethod": null,
            "paymentStatus": "unknown",
            "yapeoConfirmed": false,
            "pendingYape": false,
            "noPago": false,
            "referencesPreviousPayment": false,
            "carryOverFromPrevious": false
          },
          "markers": {
            "hasCircledAmount": false,
            "hasArrow": false,
            "hasP": true,
            "hasNP": false,
            "hasYapeo": false,
            "hasXYapear": false
          },
          "reviewFlags": [
            "marker_P_unclear"
          ],
          "notes": [],
          "confidence": 0.79
        },
        {
          "lineIndex": 2,
          "rawLineText": "Blady x10.7 = 52.7P",
          "lineType": "single_entry_line",
          "customer": {
            "rawName": "Blady",
            "normalizedCandidate": "Blady",
            "similarTo": [
              "Glady"
            ],
            "confidence": 0.82
          },
          "entries": [
            {
              "entryIndex": 0,
              "entryType": "sale",
              "description": "sale amount",
              "customerRef": "Blady",
              "amount": 52.7,
              "paymentMethod": null,
              "paymentStatus": "unknown",
              "confidence": 0.81
            }
          ],
          "items": [
            {
              "rawText": "x10.7",
              "normalizedProductCandidate": null,
              "similarTo": [],
              "quantityText": null,
              "unitPrice": 10.7,
              "lineAmount": 52.7,
              "confidence": 0.78
            }
          ],
          "operations": [],
          "amounts": {
            "subtotal": 52.7,
            "total": 52.7,
            "amountPaid": null,
            "balanceDue": null,
            "highlightedAmount": null
          },
          "payment": {
            "paymentMethod": null,
            "paymentStatus": "unknown",
            "yapeoConfirmed": false,
            "pendingYape": false,
            "noPago": false,
            "referencesPreviousPayment": false,
            "carryOverFromPrevious": false
          },
          "markers": {
            "hasCircledAmount": false,
            "hasArrow": false,
            "hasP": true,
            "hasNP": false,
            "hasYapeo": false,
            "hasXYapear": false
          },
          "reviewFlags": [
            "customer_spelling_uncertain",
            "marker_P_unclear"
          ],
          "notes": [],
          "confidence": 0.79
        },
        {
          "lineIndex": 3,
          "rawLineText": "Juliz Mary x12 = 17.8 + 113.7 ND",
          "lineType": "multi_entry_line",
          "customer": {
            "rawName": "Juliz Mary",
            "normalizedCandidate": "Juliz Mary",
            "similarTo": [
              "Juz Mary"
            ],
            "confidence": 0.44
          },
          "entries": [
            {
              "entryIndex": 0,
              "entryType": "sale",
              "description": "sale amount",
              "customerRef": "Juliz Mary",
              "amount": 17.8,
              "paymentMethod": null,
              "paymentStatus": "unknown",
              "confidence": 0.66
            },
            {
              "entryIndex": 1,
              "entryType": "balance_reference",
              "description": "trailing amount",
              "customerRef": "Juliz Mary",
              "amount": 113.7,
              "paymentMethod": null,
              "paymentStatus": "unknown",
              "confidence": 0.62
            },
            {
              "entryIndex": 2,
              "entryType": "unknown_entry",
              "description": "ND marker",
              "customerRef": "Juliz Mary",
              "amount": null,
              "paymentMethod": null,
              "paymentStatus": "unknown",
              "confidence": 0.37
            }
          ],
          "items": [
            {
              "rawText": "x12",
              "normalizedProductCandidate": null,
              "similarTo": [],
              "quantityText": null,
              "unitPrice": 12.0,
              "lineAmount": 17.8,
              "confidence": 0.61
            }
          ],
          "operations": [
            {